Account_ID,Account_Name,Account_Name_English,Account_Code,Account_Group,Account_Group_Code,Account_Status,Customer_Class,Sales_Area,Phone,Phone_1,Office_Phone,Factory_Phone,Website,Facebook,Billing_City,Billing_Province,Billing_Country,Shipping_City,Shipping_Province,Shipping_Country,Thai_Tax_ID,Register_Capital,Created_Time,Modified_Time,Last_Activity_Time,Owner,Tags,Industry,Org_Type,TSIC_ID,Billing_Street,Vol_FIBC_Per_Years,FIBC_Sling_Usage_Year
3015191000010892004,บริษัท กิ้มกี่กิจเจริญ จำกัด,,0408AA,,,Active,,QWest,,,34433154,,,,,สมุทรสาคร,,,,,0745537001121,,20200409T08:26:51+07:00,20240713T11:20:22+07:00,20251124T16:58:56+07:00,อิสราวลี ตนเสาวภาคย์ชลที,"FIBC, รอ Verify, โม",1.1.2.3.4 โรงงานหีบน้ำมันปาล์มดิบ,บริษัทจำกัด,,,,
3015191000010648006,บริษัท โกลเด้นไพรซ์แคนนิ่ง จำกัด,,0403AA,,,Active,,QWest,,,024348953,,,,,สมุทรสาคร,,,,,0745541000592,,20200325T08:15:50+07:00,20240726T11:51:06+07:00,20251215T09:44:57+07:00,อิสราวลี ตนเสาวภาคย์ชลที,"FIBC, PPW",1.1.2.2 ปลาป่น,บริษัทจำกัด,,,,
3015191000010282026,บริษัท อั๊คโซ่ โนเบล เพ้นท์ส (ประเทศไทย) จำกัด,,0387AA,,,Active,,QWest,,,34490737,,http://www.vpowdertech.com/,,,สมุทรสาคร,,,,,0105509004699,,20200227T15:46:52+07:00,20250606T10:46:11+07:00,20251029T14:46:18+07:00,ชินดนัย ศรีธรรม,"โทรไม่ติด, ไม่มีการใช้งาน PPW",2.3.4 Pigment,บริษัทจำกัด,,1/58 ตำบล ท่าทราย อำเภอเมืองสมุทรสาคร สมุทรสาคร 74000,,
3015191000010179001,บริษัท สยามฟริท จำกัด.,,0375AA,,,Active,,QWest,,,034468601,,,,,สมุทรสาคร,,,,,0745547001221,,20200220T08:18:22+07:00,20240719T15:55:04+07:00,20251215T09:45:01+07:00,อิสราวลี ตนเสาวภาคย์ชลที,"รอ Verify, โม",2.7 Non Food อื่นๆ,บริษัทจำกัด,,78 หมู่ 6 ตำบลนาดี อำเภอเมืองสมุทรสาคร จังหวัดสมุทรสาคร 74000.,,
3015191000007538511,ช.เคมีไทย,,0012AA,0012ช.เคมีไทย,0012,Active,,QWest,,,028105090,,,,,,,,,,0105513001747,,20190907T16:22:05+07:00,20240719T15:52:12+07:00,20251215T09:45:01+07:00,อิสราวลี ตนเสาวภาคย์ชลที,รอ Verify,2.7 Non Food อื่นๆ,,,,,
3015191000007538432,โรงสีธัญญกิจ,,0011AA,0011โรงสีธัญญกิจ,0011,Active,,QWest,,,,,,,บ้านโป่ง,ราชบุรี,,,,,0673535000097,,20190907T16:16:32+07:00,20251007T10:33:53+07:00,20251007T10:33:53+07:00,อิสราวลี ตนเสาวภาคย์ชลที,"รอ Verify, ไม่เปิดรับ",1.2.1.1 ข้าวตรา,,,178/2 ถ.เพชรเกษม ต.หนองอ้อ,,
3015191000007518941,คิงฟิชเชอร์ โฮลดิ้งส์,,0293AA,0293คิงฟิชเชอร์ โฮลดิ้งส์ จำกัด,0293,NonActive,,QWest,,,034419888,,,,,สมุทรสาคร,,,สมุทรสาคร,,0105515000918,,20190906T15:35:54+07:00,20251007T10:29:45+07:00,20251209T10:52:42+07:00,อิสราวลี ตนเสาวภาคย์ชลที,"รอ Verify, โม, ไม่มีการใช้งาน PPW",1.1.2.2 ปลาป่น,บริษัทจำกัด,,,5000,
3015191000000318144,คาร์กิลล์มีทส์ (ไทยแลนด์),,,,,New Accounts,,QWest,,,22632946,363240735,,,,เพชรบุรี,,,เพชรบุรี,,0105532004021,,20180212T01:18:36+07:00,20240726T14:41:33+07:00,20250330T13:22:17+07:00,อิสราวลี ตนเสาวภาคย์ชลที,สมาคมผู้ผลิตอาหารสัตว์ไทย,1.1.1.1 โรงงานอาหารสัตว์,บริษัทจำกัด,,130132 อาคารสินธรทาวเวอร์ 3 ชั้น 24 ถนนวิทยุ ลุมพินี ปทุมวัน กรุงเทพฯ 10330,,
3015191000073906026,โรงน้ำแข็งเฮืองอนงค์,,,,,,,SMI,,,020 22550845,,,,,,ลาว,,,,,,20250107T13:05:38+07:00,20250425T17:21:58+07:00,20250425T17:21:58+07:00,วิไลวรรณ ทองอยู่,,1.2.2.1 โรงน้ำแข็ง,บริษัทจำกัด,,,,
3015191000073857078,โรงน้ำแข็งพรหมภักดี,,,,,,,SMI,,,,,,,,,ลาว,,,,,,20250106T11:13:56+07:00,20250106T11:13:56+07:00,20250220T16:25:55+07:00,วิไลวรรณ ทองอยู่,,1.2.2.1 โรงน้ำแข็ง,บริษัทจำกัด,,,,
3015191000073857004,โรงงานน้ำก้อน New ไอซ์,,,,,,,SMI,,,,,,,,,ลาว,,,,,,20250106T09:38:17+07:00,20250106T09:38:17+07:00,20250220T15:57:42+07:00,วิไลวรรณ ทองอยู่,,1.2.2.1 โรงน้ำแข็ง,บริษัทจำกัด,,,,
3015191000073798045,น้ำดิ่ม น้ำก้อน สายนที,,,,,,,SMI,,,020 22643551,,,,,,ลาว,,,,,,20250103T16:48:41+07:00,20250103T16:48:41+07:00,20250326T09:41:29+07:00,วิไลวรรณ ทองอยู่,,1.2.2.1 โรงน้ำแข็ง,บริษัทจำกัด,,,,
3015191000073798010,โรงน้ำแข็งแสงเจริญ,,,,,,,SMI,,,,,,,,,ลาว,,,,,,20250103T13:22:59+07:00,20250103T13:22:59+07:00,20250220T16:46:27+07:00,วิไลวรรณ ทองอยู่,,1.2.2.1 โรงน้ำแข็ง,บริษัทจำกัด,,,,
3015191000073656129,โรงน้ำก้อน อุดมพอน,,,,,,,SMI,,,856 20 88897779,,,,,,,,,,,,20241226T17:08:33+07:00,20241226T17:08:33+07:00,20250303T15:56:33+07:00,วิไลวรรณ ทองอยู่,,1.2.2.1 โรงน้ำแข็ง,บริษัทจำกัด,,,,
3015191000073517221,โรงงานนํ้าแข็งโชกคํา,,,,,,,SMI,,,,,,,,,,,,,,,20241224T11:43:37+07:00,20241224T11:43:37+07:00,20250220T15:18:52+07:00,วิไลวรรณ ทองอยู่,,1.2.2.1 โรงน้ำแข็ง,บริษัทจำกัด,,ปากเช แขวงจําปาสัก ประเทศลาว,,
3015191000071780030,ซี จี เอ,,,,,,,SMI,,,,,www.cga.co.th,,วังทองหลาง,กรุงเทพมหานคร,,,,,0105546003323,9000000,20241121T14:16:27+07:00,20241121T14:16:27+07:00,20251215T09:44:55+07:00,วิไลวรรณ ทองอยู่,,1.2.1.1 ข้าวตรา,บริษัทจำกัด,,1213/298 ถนนลาดพร้าว แขวงพลับพลา,,
3015191000060467016,แมททีเรียล เวิลด์,,,,,New Accounts,,SMI,,,025016300,,www.materialworld.co.th,,,นนทบุรี,,,,,0135539000527,100000000,20240328T12:04:10+07:00,20250527T14:01:52+07:00,20251215T09:44:55+07:00,วรางคณา กัณหาชาติ,,3. Trader,บริษัทจำกัด,,55/5 หมู่ที่ 1 ถนนชัยพฤกษ์ ตำบลคลองพระอุดม อำเภอปากเกร็ด จ.นนทบุรี 11120,,
3015191000039977057,ภูมิ โลจิสติกส์,,,,,New Accounts,,SMI,,,0995144744,,,,,สระบุรี,,,,,0195562003201,2000000,20221104T14:35:21+07:00,20250425T17:05:12+07:00,20250425T17:05:13+07:00,หิมวัต ถนัดค้า,,,บริษัทจำกัด,,67/2 หมู่ที่ 6 ต.ทับกวาง อ.แก่งคอย,,
3015191000030896038,ออกัสท์ อินเตอร์ไพรส์,,,,,New Accounts,,SMI,,,,,,,,,,,,,0105563009784,1000000,20220125T14:56:55+07:00,20240722T17:06:39+07:00,20240722T17:06:39+07:00,Test Account Account,,3. Trader,บริษัทจำกัด,,,,
3015191000030106006,สยาม อินเตอร์เทรด แพคเกจจิ้ง,,,,,New Accounts,,SMI,,,,,,,,,,,,,0105547066167,5000000,20220105T08:52:13+07:00,20240722T16:59:22+07:00,20240722T16:59:22+07:00,Test Account Account,,2.7 Non Food อื่นๆ,บริษัทจำกัด,,,,
3015191000029745096,กระสอบโคราช,,,,,New Accounts,,SMI,,,,,,,,นครราชสีมา,,,,,303549003541,4500000,20211223T13:00:38+07:00,20240722T16:59:22+07:00,20240722T16:59:22+07:00,Test Account Account,,,ห้างหุ้นส่วนจำกัด,,355 ม.8 ต.บ้านโพธิ์ อ.เมืองนครราชสีมา จ.นครราชสีมา 30310,,
3015191000029745073,โคราชโพลีแบ็ก,,,,,New Accounts,,SMI,,,,,,,,นครราชสีมา,,,,,303548002703,11000000,20211223T12:59:25+07:00,20240722T16:59:22+07:00,20240722T16:59:22+07:00,Test Account Account,Fabric,,ห้างหุ้นส่วนจำกัด,,334 ม.8 ถ. ต.บ้านโพธิ์ อ.เมืองนครราชสีมา จ.นครราชสีมา 30310,,
3015191000029192021,กาญจนบุรี โพลีแพค,,,,,New Accounts,,SMI,,,,,,,,กาญจนบุรี,,,,,715560002279,5000000,20211207T09:49:02+07:00,20240722T16:59:22+07:00,20240722T16:59:22+07:00,Test Account Account,Fabric,,บริษัทจำกัด,,88 ม.4 ต.ทุ่งทอง อ.ท่าม่วง จ.กาญจนบุรี 71110,,
3015191000028882054,พงตึกค้ากระสอบ,,,,,NonActive,,SMI,,,,,,,,กาญจนบุรี,,,,,0713555000571,2000000,20211129T09:06:11+07:00,20220930T18:01:12+07:00,20251215T09:44:58+07:00,Test Account Account,Fabric,,ห้างหุ้นส่วนจำกัด,,14 ม.3 ถ. ต.พงตึก อ.ท่ามะกา จ.กาญจนบุรี 71120,,
3015191000028162182,กระสอบเกษตร,,,,,NonActive,,SMI,,,,,,,,สมุทรปราการ,,,,,105526023817,30000000,20211109T13:24:08+07:00,20220930T17:44:02+07:00,20220930T17:44:02+07:00,หิมวัต ถนัดค้า,,,บริษัทจำกัด,,226 นิคมอุตสาหกรรมบางปู ถ.สุขุมวิท ต.แพรกษา อ.เมืองสมุทรปราการ จ.สมุทรปราการ 10280,,
3015191000027035011,ไทยอินเตอร์แวฟวิ่ง,,,,,NonActive,,SMI,,,,,,,,สมุทรสาคร,,,,,0745536000482,10000000,20211007T13:41:47+07:00,20220930T16:42:57+07:00,20230405T13:20:53+07:00,Test Account Account,,,บริษัทจำกัด,,144 หมู่ที่ 6 ถนนเพชรเกษม ซอย 91 ต.สวนหลวง อ.กระทุ่มแบน,,
3015191000067314008,เนสท์เล่ เพียวริน่า เพ็ทแคร์,,,,,,,,,,,,,,,,,,,,,,20240821T10:23:52+07:00,20240821T10:23:52+07:00,20250402T17:13:35+07:00,สุนิสา กล้าแข็ง,,,บริษัทจำกัด,,,,
3015191000003451492,โรงน้ำแข็งกรเดช,,0132AA,0132โรงน้ำแข็งกรเดช,0132,Active,,,,,,,,,รัตนบุรี,สุรินทร์,ไทย,,,,,,20181108T10:02:04+07:00,20220930T17:38:01+07:00,20220930T17:38:01+07:00,หิมวัต ถนัดค้า,,1.2.2.1 โรงน้ำแข็ง,ห้างหุ้นส่วนจำกัด,,93 ม.9 ต.ไผ่,,
3015191000003415010,Black Pearl,,,,,Active,,,,,,,,,,,,,,,,,20181104T14:51:14+07:00,20220930T17:38:01+07:00,20251215T09:44:58+07:00,หิมวัต ถนัดค้า,,2.2.1.1 Cement,,,ร้านกุ้งใจดี,,
