Account_ID,Account_Name,Account_Name_English,Account_Code,Account_Group,Account_Group_Code,Account_Status,Customer_Class,Sales_Area,Phone,Phone_1,Office_Phone,Factory_Phone,Website,Facebook,Billing_City,Billing_Province,Billing_Country,Shipping_City,Shipping_Province,Shipping_Country,Thai_Tax_ID,Register_Capital,Created_Time,Modified_Time,Last_Activity_Time,Owner,Tags,Industry,Org_Type,TSIC_ID,Billing_Street,Vol_FIBC_Per_Years,FIBC_Sling_Usage_Year
3015191000032540000,เบสท์ ควอลิตี้ เคมีคัลส์,,,,,New Accounts,,QWest,,,034989551,,,,,,,,,,0105547013381,9000000,20220317T11:43:55+07:00,20240722T16:59:22+07:00,20251202T16:46:43+07:00,อิสราวลี ตนเสาวภาคย์ชลที,โม,2.3.2 Plastic Compound Resin,บริษัทจำกัด,20221,77/23 หมู่ที่ 7 ต.คลองโยง อ.พุทธมณฑล จ.นครปฐม,,
3015191000053291000,ยูนิมิเนอรัล,,,,,New Accounts,,QCentral,,,,,,,,สระบุรี,,,,,0105561016881,20000000,20231023T16:10:55+07:00,20250404T11:52:51+07:00,20251112T15:40:52+07:00,วีรวรรณ รอบแคว้น,,2.2.1.3 ปูนขาว,บริษัทจำกัด,20299,66 หมู่ที่ 6 ตำบลหน้าพระลาน อำเภอเฉลิมพระเกียรติ จ.สระบุรี 18240,,
3015191000020176000,เซไก คัลเลอร์,,,,,New Accounts,,QEast,02-173-4470,,021734470,,,,,สมุทรปราการ,,,สมุทรปราการ,,0115547000514,,20210324T15:16:40+07:00,20250402T15:42:11+07:00,20251215T09:44:59+07:00,สุนิสา กล้าแข็ง,,2.7 Non Food อื่นๆ,บริษัทจำกัด,20299,109/9091 หมู่ที่ 21 ถนนบางพลีตำหรุ ต.บางพลีใหญ่ อ.บางพลี จ.สมุทรปราการ,,
3015191000018189300,เอ็กซ์ตร้า เทคโนโลยี เคมีคอล,,0374AA,,,NonActive,,QEast,,,024523511,,,,,สมุทรปราการ,,,,,0103549011066,,20210121T11:13:51+07:00,20250402T15:42:11+07:00,20251215T09:44:59+07:00,สุนิสา กล้าแข็ง,PPW 010k,2.7 Non Food อื่นๆ,ห้างหุ้นส่วนจำกัด,20299,92/8 หมู่ที่ 4 ต.บ้านคลองสวน อ.พระสมุทรเจดีย์ จ.สมุทรปราการ,,
3015191000010478000,ฮันฮวา เคมิคัล (ไทยแลนด์),,0392AA,,,NonActive,,QEast,,,023153207,,,,,สมุทรปราการ,,,สมุทรปราการ,,0105532073430,,20200312T14:12:48+07:00,20250402T15:42:11+07:00,20251215T09:45:01+07:00,สุนิสา กล้าแข็ง,"PPW 03K, ไม่เปิดรับ",2.3.1 Basic Resin,บริษัทจำกัด,20299,,,
3015191000007763000,พาราเคมีภัณฑ์,Bara Chemical,0239AA,0239Sumitomo Chemical,0239,NonActive,,QEast,0 2323 9420-1,,023231633,,,,,สมุทรปราการ,,,สมุทรปราการ,,0105516003104,,20190920T13:40:07+07:00,20250402T15:44:38+07:00,20251217T09:48:00+07:00,สุนิสา กล้าแข็ง,"ไม่มีการใช้งาน PPW, FIBC",2.3.4 Pigment,บริษัทจำกัด,20299,,,
3015191000016789500,สุธากัญจน์​ สาขา00002,,0496AB,,,NonActive,,QNorth,0-2017-7461,,036436421,,http://www.goldenlime.co.th/,,,ลพบุรี,,,ลพบุรี,,0107556000248,,20201210T14:29:19+07:00,20240529T13:46:49+07:00,20251215T09:44:55+07:00,สุนิษา ภิญโญ,FSE,2.2.1.3 ปูนขาว,บริษัทมหาชนจำกัด,20299,7 ซ.11 สาย 3 หมู่ 12 ตำบลช่องสาริกา อำเภอพัฒนานิคม,,